question,answer,thematic,subThematic,level,points,times
En quelle année a été créé le langage Python ?,"""{1980}""",Informatique,Langages de programmation,Moyen,10,18
En quelle année a été créé le langage C ?,"""{1972}""",Informatique,Langages de programmation,Moyen,10,16
Quelle est la position de Francis NGANNOU dans la WBC ?,"""{10ème}""",Sports,Boxe,Moyen,10,20
Quelle athlète a réalisé un exploit en effectuant en 24h 1555 longueurs en apnée ?,"""{Pascal Vignais}""",Sports,Apnée,Difficile,10,22
Quelle équipe nationale a remporté le championnat UFOA-U15 ?,"""{Bénin}""",Sports,Football,Moyen,10,18
Quel est le titre de la nouvelle chanson d’Axel Merryl ?,"""{Maman}""",Musique,Chansons,Facile,10,16
